<?xml version="1.0" encoding="UTF-8"?> 
<!DOCTYPE vehicles SYSTEM "DTDConcesionario.dtd">
<vehicles>
<car>
	<numBastidor numero="bastidor"></numBastidor>
	<matricula numero="matricula"></matricula>
	<colour tipo="color"></colour>
	<numAsientos cantidad="asientos"></numAsientos>
	<precio total="precio"></precio>
	<numPuertas cantidad="puertas"></numPuertas>
	<capacidadMaletero cantidad="capacidad"></capacidadMaletero>
	<serie numero="serie"></serie>
</car>
<truck>
	<numBastidor numero="bastidor"></numBastidor>
	<matricula numero="matricula"></matricula>
	<colour tipo="color"></colour>
	<numAsientos cantidad="asientos"></numAsientos>
	<precio total="precio"></precio>
	<carga cantidad="carga"></carga>
	<tipoMercancia tipo="mercancia"></tipoMercancia>
	<serie numero="serie"></serie>
</truck>
</vehicles>